{
  "schema_version": "leva.et13.a11y-cases.v1",
  "case_catalog_version": "leva.et13.catalog.v1",
  "catalog_sha256": "0a37e29c3ee5decf3b24bccfbb997a3329ebfa0ddf65030fe0c80e79bf1e2c75",
  "projection_contract_sha256": "106e8d2951f44345611627df3cef5a52eef938ab1dfac117750febaa51fde3ca",
  "projection_matrix": [
    {
      "fixture_id": "web-today-available",
      "capture_scope": "body_projection",
      "source_widget": "TodayMissionSection",
      "substitutions": [
        "controller/provider state replaced by approved deterministic fixture"
      ]
    },
    {
      "fixture_id": "web-path-current-week",
      "capture_scope": "body_projection",
      "source_widget": "MissionPathPlanView",
      "substitutions": [
        "controller/provider state replaced by approved deterministic fixture"
      ]
    },
    {
      "fixture_id": "web-content-reading",
      "capture_scope": "body_projection",
      "source_widget": "WebContentProjection",
      "substitutions": [
        "AdSense slot replaced by explicit offline blocked-network evidence slot"
      ]
    },
    {
      "fixture_id": "web-workspace-idle",
      "capture_scope": "body_projection",
      "source_widget": "SandboxLayout",
      "substitutions": [
        "controller state replaced by approved deterministic fixture",
        "Monaco callbacks disabled except production readiness"
      ]
    },
    {
      "fixture_id": "web-review-loaded",
      "capture_scope": "component_projection",
      "source_widget": "WebReviewProjection",
      "substitutions": [
        "controller state replaced by approved deterministic fixture"
      ]
    },
    {
      "fixture_id": "web-mentor-context-preview",
      "capture_scope": "body_projection",
      "source_widget": "WebMentorContextProjection",
      "substitutions": [
        "controller/provider state replaced by approved deterministic fixture"
      ]
    },
    {
      "fixture_id": "admin-kpi-dashboard",
      "capture_scope": "body_projection",
      "source_widget": "AdminKpiDashboardProjection",
      "substitutions": [
        "controller/provider state replaced by approved deterministic fixture"
      ]
    },
    {
      "fixture_id": "admin-support-long-wire",
      "capture_scope": "component_projection",
      "source_widget": "AdminSupportDetailProjection",
      "substitutions": [
        "live provider and dialog shell replaced by deterministic AlertDialog host"
      ]
    },
    {
      "fixture_id": "mobile-today-available",
      "capture_scope": "body_projection",
      "source_widget": "MobileTodayProjection",
      "substitutions": [
        "native AppBar and route shell omitted",
        "controller/provider state replaced by approved deterministic fixture"
      ]
    },
    {
      "fixture_id": "mobile-content-reading",
      "capture_scope": "body_projection",
      "source_widget": "MobileContentProjection",
      "substitutions": [
        "native AppBar and route shell omitted",
        "periodic dwell timer frozen",
        "controller/provider state replaced by approved deterministic fixture"
      ]
    },
    {
      "fixture_id": "dp-design-mission-ledger",
      "capture_scope": "component_projection",
      "source_widget": "DpEt13MissionLedgerFixture",
      "substitutions": [
        "hosted by the Flutter Web production distribution"
      ]
    },
    {
      "fixture_id": "dp-design-context-payload-preview",
      "capture_scope": "component_projection",
      "source_widget": "DpEt13ContextPayloadPreviewFixture",
      "substitutions": [
        "hosted by the Flutter Web production distribution"
      ]
    },
    {
      "fixture_id": "web-community-free",
      "capture_scope": "body_projection",
      "source_widget": "WebCommunityBoardProjection",
      "substitutions": [
        "controller/provider state replaced by approved deterministic fixture"
      ]
    },
    {
      "fixture_id": "web-community-qna",
      "capture_scope": "body_projection",
      "source_widget": "WebCommunityBoardProjection",
      "substitutions": [
        "controller/provider state replaced by approved deterministic fixture"
      ]
    },
    {
      "fixture_id": "web-community-feedback",
      "capture_scope": "body_projection",
      "source_widget": "WebCommunityBoardProjection",
      "substitutions": [
        "controller/provider state replaced by approved deterministic fixture"
      ]
    }
  ],
  "fixture_ids": [
    "web-today-available",
    "web-path-current-week",
    "web-content-reading",
    "web-workspace-idle",
    "web-review-loaded",
    "web-mentor-context-preview",
    "admin-kpi-dashboard",
    "admin-support-long-wire",
    "mobile-today-available",
    "mobile-content-reading",
    "dp-design-mission-ledger",
    "dp-design-context-payload-preview",
    "web-community-free",
    "web-community-qna",
    "web-community-feedback"
  ],
  "case_count": 30,
  "surface_case_counts": {
    "web": 18,
    "admin": 4,
    "mobile": 4,
    "dp_design": 4
  },
  "cases": [
    {
      "case_id": "web-today-available--a11y--w320--light--text200",
      "fixture_id": "web-today-available",
      "owner": "web",
      "distribution": "web",
      "route": "/?fixture=web-today-available",
      "ready_semantics_label": "ET13_READY:web-today-available",
      "surface_label": "web-today-available",
      "capture_scope": "body_projection",
      "source_widget": "TodayMissionSection",
      "substitutions": [
        "controller/provider state replaced by approved deterministic fixture"
      ],
      "width": 320,
      "height": 900,
      "device_pixel_ratio": 1,
      "theme": "light",
      "text_scale_percent": 200,
      "locale": "ko-KR",
      "timezone": "UTC",
      "reduced_motion": true,
      "artifact_path": "a11y/web/web-today-available--a11y--w320--light--text200.json"
    },
    {
      "case_id": "web-today-available--a11y--w1240--dark--text200",
      "fixture_id": "web-today-available",
      "owner": "web",
      "distribution": "web",
      "route": "/?fixture=web-today-available",
      "ready_semantics_label": "ET13_READY:web-today-available",
      "surface_label": "web-today-available",
      "capture_scope": "body_projection",
      "source_widget": "TodayMissionSection",
      "substitutions": [
        "controller/provider state replaced by approved deterministic fixture"
      ],
      "width": 1240,
      "height": 900,
      "device_pixel_ratio": 1,
      "theme": "dark",
      "text_scale_percent": 200,
      "locale": "ko-KR",
      "timezone": "UTC",
      "reduced_motion": true,
      "artifact_path": "a11y/web/web-today-available--a11y--w1240--dark--text200.json"
    },
    {
      "case_id": "web-path-current-week--a11y--w320--light--text200",
      "fixture_id": "web-path-current-week",
      "owner": "web",
      "distribution": "web",
      "route": "/?fixture=web-path-current-week",
      "ready_semantics_label": "ET13_READY:web-path-current-week",
      "surface_label": "web-path-current-week",
      "capture_scope": "body_projection",
      "source_widget": "MissionPathPlanView",
      "substitutions": [
        "controller/provider state replaced by approved deterministic fixture"
      ],
      "width": 320,
      "height": 900,
      "device_pixel_ratio": 1,
      "theme": "light",
      "text_scale_percent": 200,
      "locale": "ko-KR",
      "timezone": "UTC",
      "reduced_motion": true,
      "artifact_path": "a11y/web/web-path-current-week--a11y--w320--light--text200.json"
    },
    {
      "case_id": "web-path-current-week--a11y--w1240--dark--text200",
      "fixture_id": "web-path-current-week",
      "owner": "web",
      "distribution": "web",
      "route": "/?fixture=web-path-current-week",
      "ready_semantics_label": "ET13_READY:web-path-current-week",
      "surface_label": "web-path-current-week",
      "capture_scope": "body_projection",
      "source_widget": "MissionPathPlanView",
      "substitutions": [
        "controller/provider state replaced by approved deterministic fixture"
      ],
      "width": 1240,
      "height": 900,
      "device_pixel_ratio": 1,
      "theme": "dark",
      "text_scale_percent": 200,
      "locale": "ko-KR",
      "timezone": "UTC",
      "reduced_motion": true,
      "artifact_path": "a11y/web/web-path-current-week--a11y--w1240--dark--text200.json"
    },
    {
      "case_id": "web-content-reading--a11y--w320--light--text200",
      "fixture_id": "web-content-reading",
      "owner": "web",
      "distribution": "web",
      "route": "/?fixture=web-content-reading",
      "ready_semantics_label": "ET13_READY:web-content-reading",
      "surface_label": "web-content-reading",
      "capture_scope": "body_projection",
      "source_widget": "WebContentProjection",
      "substitutions": [
        "AdSense slot replaced by explicit offline blocked-network evidence slot"
      ],
      "width": 320,
      "height": 900,
      "device_pixel_ratio": 1,
      "theme": "light",
      "text_scale_percent": 200,
      "locale": "ko-KR",
      "timezone": "UTC",
      "reduced_motion": true,
      "artifact_path": "a11y/web/web-content-reading--a11y--w320--light--text200.json"
    },
    {
      "case_id": "web-content-reading--a11y--w1240--dark--text200",
      "fixture_id": "web-content-reading",
      "owner": "web",
      "distribution": "web",
      "route": "/?fixture=web-content-reading",
      "ready_semantics_label": "ET13_READY:web-content-reading",
      "surface_label": "web-content-reading",
      "capture_scope": "body_projection",
      "source_widget": "WebContentProjection",
      "substitutions": [
        "AdSense slot replaced by explicit offline blocked-network evidence slot"
      ],
      "width": 1240,
      "height": 900,
      "device_pixel_ratio": 1,
      "theme": "dark",
      "text_scale_percent": 200,
      "locale": "ko-KR",
      "timezone": "UTC",
      "reduced_motion": true,